<?xml version="1.0" encoding="UTF-8"?>
<Libro id="2" precio="30.50" xmlns:xsi="http://www.w3.org/2001/XMLSchema-instance" 
        xsi:noNamespaceSchemaLocation= "02_XSD_Libro.xsd">
    <Titulo>Fray Perico y su borrico</Titulo>
    <Autor>Yo no</Autor>
    <Editorial>
        <nombre>Espasa</nombre>
        <direccion>Calle la plata 29</direccion>
    </Editorial>
    <fecha_edicion>2011-11-04</fecha_edicion>
    <paginas valor="154" />
    <prologo pagina="5">
        Libro sobre un fraile que esta en una iglesia con un burro
    </prologo>
</Libro>